{
  "lawpack_digest_sha256": "1de4d5d9922ef9c0caba67bbeb2d98d125fc5c2b456c62a7c1f2a56b97c713b8",
  "jurisdiction_id": "ex",
  "domain": "civil",
  "as_of_date": "2025-01-01",
  "artifact_path": "dist/lawpacks/ex/civil/1de4d5d9922ef9c0caba67bbeb2d98d125fc5c2b456c62a7c1f2a56b97c713b8.lawpack.zip",
  "artifact_sha256": "15bb6f94e0ff5bffba78b44be32691a54830959de7da9ede49ee139f35c91098",
  "components": {
    "lawpack_yaml_sha256": "e4f869c9915ff6c6d580461e3b63e462c49d671a97c435b3ccf421b11519fc74",
    "index_json_sha256": "5ca77e56b157c09cb1aa7e4e97a7e80e61301c565c735e424bb1108ede12d3ec",
    "akn_sha256": {
      "akn/main.xml": "5c1745b938dae09a13155f31a4454197cce9dde919813c56014a05815389cbf6"
    },
    "sources_sha256": "5802ba79348ec09231417fc271987df619c22b245b934cbac0f62ec3d711b364"
  },
  "provenance": {
    "module_manifest_path": "module.yaml",
    "sources_manifest_path": "sources.yaml",
    "raw_sources": {},
    "normalization": {
      "recipe_id": "mez.law.normalization.v1",
      "tool": "mez",
      "tool_version": "0.4.1",
      "inputs": [
        {
          "module_id": "org.momentum.mez.legal.ex.civil.corpus",
          "module_version": "0.1.0",
          "sources_manifest_sha256": "5802ba79348ec09231417fc271987df619c22b245b934cbac0f62ec3d711b364"
        }
      ],
      "notes": ""
    }
  }
}
